{
  "$schema": "./DevelopmentTuning.schema.json",
  "Version": 1,

  "TierVelocityTuning": {
    "TierEnemyMinVelocity": [25000.0, 45000.0, 80000.0, 140000.0, 220000.0],
    "TierEnemyMaxVelocity": [55000.0, 90000.0, 150000.0, 230000.0, 280000.0]
  },

  "TechTreeTuning": {
    "ResearchCostToLevel2": { "Budget": 450, "Steel": 300, "Exotic": 0 },
    "ResearchCostToLevel3": { "Budget": 900, "Steel": 600, "Exotic": 0 },
    "ProductionBonusByLevel": [1.0, 1.2, 1.8]
  },

  "ProjectileDefaults": {
    "Mass": 5000.0,
    "Length": 0.5,
    "HasGuidance": false,
    "GuidanceAccuracy": 0.0,
    "ImpactCoupling": 0.002
  },

  "EarthThreatTuning": {
    "EnemyEarthThreatCoupling": 1.0,
    "EarthDestructionThresholdMJ": 0.0
  }
}
